owner_id,owner_username,shortcode,is_video,caption,comments,likes,created_at,location,imageUrl,multiple_images
104820548,thiagomlcorrea,B3XwlbpJHKi,False,This is certainly where I'd rather be right now. Sun. Beach. ☀️🌊 free as a bird !,898,13001,1570567800,"{'id': '249711882', 'has_public_page': True, 'name': 'Hilton Moorea Lagoon Resort and Spa', 'slug': 'hilton-moorea-lagoon-resort-and-spa'}",https://instagram.flhr13-1.fna.fbcdn.net/v/t51.2885-15/72488620_167490257707680_3918296351678069118_n.jpg?stp=dst-jpg_e35_p1080x1080&_nc_ht=instagram.flhr13-1.fna.fbcdn.net&_nc_cat=100&_nc_ohc=Pzlc2L0OUOIAX_b45G6&edm=AOQ1c0wBAAAA&ccb=7-5&oh=00_AfB4vKtG-_Kkpb2K5BK8Kq3SDCjVC2Ryi6oUGwNCaWG6aA&oe=65E96F58&_nc_sid=8b3546,True
104820548,thiagomlcorrea,BvkhBG-FdJQ,False,"Oásis em Huacachina, o único das Americas! Esse landscape no deserto fica a sudoeste do Peru. 1 hora de carro do nosso hotel em Paracas @hotelparacas. Bem tranquilo o acesso. Aqui é o lugar perfeito para um dose de adrenalina nas dunas, tanto de buggy quanto de sandboard. Fizemos o rolê com o @perucheaptours. Amanhã partiu Ilhas Ballestas.",546,25784,1553815976,"{'id': '224414912', 'has_public_page': True, 'name': 'Huacachina, Ica, Peru', 'slug': 'huacachina-ica-peru'}",https://instagram.flhr13-1.fna.fbcdn.net/v/t51.2885-15/54446669_344682466390301_5937580658377999677_n.jpg?stp=dst-jpg_e35&_nc_ht=instagram.flhr13-1.fna.fbcdn.net&_nc_cat=105&_nc_ohc=33RGDhHI_yUAX-zZjRC&edm=AOQ1c0wBAAAA&ccb=7-5&oh=00_AfDT6VAxyobTFs1qus3_2IP3iP-9f99VVUqOIA7YbJ_JvA&oe=65E7BEC5&_nc_sid=8b3546,False
104820548,thiagomlcorrea,Bw0PWxnFX7s,False,"A Rainbow Mountain fica a umas 4hrs de Cusco, a trilha pra chegar ao topo e voltar deu quase 10km, chegando a 5050m de altitude! A montanha é uma maravilha natural que ostenta-se como arco-íris natural. A razão dessa pigmentação em forma de listras coloridas é devido às camadas estratificadas de arenito com grandes quantidades de ferro e outros minerais. A natureza é muito perfeita né? ⛰ 🌈 🇵🇪 @killaexpeditions @marriotthotels @jwmarriottcusco",367,26389,1556491071,"{'id': '172171013693740', 'has_public_page': True, 'name': 'Rainbow Mountain', 'slug': 'rainbow-mountain'}",https://instagram.flhr13-1.fna.fbcdn.net/v/t51.2885-15/58410247_2296607673947204_6607683171954482906_n.jpg?stp=dst-jpg_e35&_nc_ht=instagram.flhr13-1.fna.fbcdn.net&_nc_cat=108&_nc_ohc=AqL4FHLa6-MAX8eCfCS&edm=AOQ1c0wBAAAA&ccb=7-5&oh=00_AfCFtvWXSbe6WtGuLyTeStx9jQb2FWudkTlvbL_ywI8Guw&oe=65E9043C&_nc_sid=8b3546,True
104820548,thiagomlcorrea,Cx3o5wVJK4J,False,"Chegamos bem cedinho para aproveitar muito o parque aquático da Universal em Orlando: o Volcano Bay ☀️💦 @universaldestinationsbrasil 
São muitas atrações e com esse calor, não teve nada melhor!  O que eu mais gostei foi o Ko’okiri Body Plunge, a atração mais radical do parque é um escorregador com queda única de 70graus, numa altura de 38m. O Vicente adorou os toboáguas. 
Já queremos voltar hahaha",81,1788,1696191565,"{'id': '370042143393482', 'has_public_page': True, 'name': ""Universal's Volcano Bay"", 'slug': 'universals-volcano-bay'}",https://instagram.flhr13-1.fna.fbcdn.net/v/t39.30808-6/385248443_18392310910052549_8600297937156408156_n.jpg?stp=dst-jpg_e35_p1080x1080_sh0.08&_nc_ht=instagram.flhr13-1.fna.fbcdn.net&_nc_cat=105&_nc_ohc=je8jg8NRwBgAX9F7A1m&edm=AOQ1c0wAAAAA&ccb=7-5&oh=00_AfBh4WBguyWqLLAMiWfdJKnrVddfvizLHJvO2IAAVLO-Lw&oe=65E82F8E&_nc_sid=8b3546,False
104820548,thiagomlcorrea,Cxv3JNxpTz-,True,"Um pouquinho desse dia incrível que passamos nos parques da Universal aqui em Orlando. Fomos no Universal Studios Florida e Universal Islands of Adventure. Tem muita atração legal para todas as idades. Vicente e Ana Laura adoraram as que se molhavam, e vale a pena trazer mais uma roupa 💦  @universaldestinationsbrasil #ad",108,502,1695930754,"{'id': '874232247', 'has_public_page': True, 'name': 'Universal Orlando Resort', 'slug': 'universal-orlando-resort'}",https://instagram.flhr13-1.fna.fbcdn.net/v/t51.2885-15/384112177_327329349845709_9063619650626185164_n.jpg?stp=dst-jpg_e35_p1080x1080_sh0.08&_nc_ht=instagram.flhr13-1.fna.fbcdn.net&_nc_cat=109&_nc_ohc=aBgTJKAcsT0AX_anfve&edm=AOQ1c0wBAAAA&ccb=7-5&oh=00_AfDSCQ4sRjOKrRpJDycbyXRGMissvgedbN-GDtwpxf-YaQ&oe=65E5AB19&_nc_sid=8b3546,False
104820548,thiagomlcorrea,CtP0xWFpMuo,True,Whale sharks in the Philippines,26,645,1686265829,"{'id': '221555314', 'has_public_page': True, 'name': 'Philippines', 'slug': 'philippines'}",https://instagram.flhr13-1.fna.fbcdn.net/v/t51.2885-15/352153111_608341911267232_3605782835044027416_n.jpg?stp=dst-jpg_e35_p1080x1080_sh0.08&_nc_ht=instagram.flhr13-1.fna.fbcdn.net&_nc_cat=104&_nc_ohc=jh3lnLqzXc4AX8XWi8w&edm=AOQ1c0wBAAAA&ccb=7-5&oh=00_AfCNOQIBWtosldbqIgBMyfKY42LbGab7-PCCYK0dDZ67mA&oe=65E57FB7&_nc_sid=8b3546,False
104820548,thiagomlcorrea,Cp3QOJDpbg5,True,So insane! Twin Lagoon @ Coron Philippines 🇵🇭😍,51,3790,1678998837,"{'id': '242826571', 'has_public_page': True, 'name': 'Twin Lagoon', 'slug': 'twin-lagoon'}",https://instagram.flhr13-1.fna.fbcdn.net/v/t51.2885-15/335824570_895670224984633_1657922835361803129_n.jpg?stp=dst-jpg_e15&_nc_ht=instagram.flhr13-1.fna.fbcdn.net&_nc_cat=101&_nc_ohc=G866GzggyJQAX8_J147&edm=AOQ1c0wBAAAA&ccb=7-5&oh=00_AfCa09CCbn1rXNGMy5YWDiI7Sd7KBtv6Gdo8MrcuE8fMBA&oe=65E55760&_nc_sid=8b3546,False
104820548,thiagomlcorrea,Cikox4CpJ2Z,False,So much fun exploring Cuba 🇨🇺,26,2152,1663341712,"{'id': '111067806261000', 'has_public_page': True, 'name': 'Cueva De Saturno, Cuba', 'slug': 'cueva-de-saturno-cuba'}",https://instagram.flhr13-1.fna.fbcdn.net/v/t51.2885-15/307298695_2889910911304337_7649722226458013765_n.jpg?stp=dst-jpg_e35_p1080x1080&_nc_ht=instagram.flhr13-1.fna.fbcdn.net&_nc_cat=105&_nc_ohc=L80Tz56jVVMAX_L9tXN&edm=AOQ1c0wBAAAA&ccb=7-5&oh=00_AfChOaYsqRhD3Pd2ul5Z0ktqm15T4xCiDBMOUvUDoMzRuQ&oe=65E8887E&_nc_sid=8b3546,True
104820548,thiagomlcorrea,CiisNJcpRHW,False,Sunset at the best hotel in Havana 🇨🇺😍 @kempinskihavana,25,1642,1663276399,"{'id': '950841071712450', 'has_public_page': True, 'name': 'Gran Hotel Manzana Kempinski La Habana', 'slug': 'gran-hotel-manzana-kempinski-la-habana'}",https://instagram.flhr13-1.fna.fbcdn.net/v/t51.2885-15/306878101_3235433203366767_2407253081061072229_n.jpg?stp=dst-jpg_e35_p1080x1080&_nc_ht=instagram.flhr13-1.fna.fbcdn.net&_nc_cat=103&_nc_ohc=H27dhvgZnOgAX-NrN2w&edm=AOQ1c0wBAAAA&ccb=7-5&oh=00_AfAnBzyUustEKfEd5wZzBjJTrJoBRMUlpuJqiYqU4J3HiA&oe=65E8C0C8&_nc_sid=8b3546,True
104820548,thiagomlcorrea,CifXiX7tR-B,True,Hola Cuba! 🇨🇺🌴☀️,63,1732,1663164976,,https://instagram.flhr13-1.fna.fbcdn.net/v/t51.2885-15/306513715_557096872880647_462346162003440990_n.jpg?stp=dst-jpg_e15&_nc_ht=instagram.flhr13-1.fna.fbcdn.net&_nc_cat=107&_nc_ohc=7SUIp48RNTwAX_ZOxPk&edm=AOQ1c0wBAAAA&ccb=7-5&oh=00_AfBp4cCtDcS78Dp_L1fx-Bt4CE6-bzIELfdE17kJzaFU6Q&oe=65E544B4&_nc_sid=8b3546,False
211753590,redley85,ChCxmzPlaUJ,True,"Eu e meu parcerinho no nosso programa preferido ☀️🌊

Qual o de vocês? 

#DiaDosPaisRedley. Corre no site pra aproveitar!",46,699,1660058147,,https://instagram.flhr13-1.fna.fbcdn.net/v/t51.2885-15/298166619_104647208965002_8970502603605498250_n.jpg?stp=dst-jpg_e15&_nc_ht=instagram.flhr13-1.fna.fbcdn.net&_nc_cat=106&_nc_ohc=pZBQsdtjmTEAX_WQPBm&edm=AOQ1c0wBAAAA&ccb=7-5&oh=00_AfBjIesKhj9p1vY55y1P05EymlM3pUyRblAMZ2KuiPW2Xw&oe=65E5A928&_nc_sid=8b3546,False
104820548,thiagomlcorrea,CgNbwr0peEe,False,"O novo @Breitling Superocean tem em seu projeto o equilíbrio perfeito entre mostrar sua tradição versus a modernidade. @breitlingboutique_brazil
#Breitling #squadonamission #superocean #divingwatch",35,571,1658268167,"{'id': '212928653', 'has_public_page': True, 'name': 'Miami Beach, Florida', 'slug': 'miami-beach-florida'}",https://instagram.flhr13-1.fna.fbcdn.net/v/t51.2885-15/294258650_5420711861308269_8356334747735436400_n.jpg?stp=dst-jpg_e35_p1080x1080&_nc_ht=instagram.flhr13-1.fna.fbcdn.net&_nc_cat=109&_nc_ohc=zSCeZbCrQbUAX-l1n1V&edm=AOQ1c0wBAAAA&ccb=7-5&oh=00_AfAS9lRb7ToqpKEwDne5_CJnhM67URT0rV4LzJ4DzaIMxQ&oe=65E8DAB9&_nc_sid=8b3546,True
